{
  "task_id": "REQ_RES_2026_01",
  "project_id": "SAV_DEP_2026_01",
  "query": "Средние рыночные ставки по сберегательным вкладам до востребования физических лиц в РФ, норматив ПСК и требование раскрытия МГС (ЦБ РФ)",
  "research_objective": "Собрать первичные данные по ставкам вкладов и требованиям раскрытия минимальной гарантированной ставки для расчета тарифной сетки и юридического аудита",
  "target_audience": "executive",
  "depth_level": "standard_deep",
  "required_entities": [
    "metric",
    "timeline",
    "market_share"
  ],
  "out_of_scope": [
    "вклады юридических лиц",
    "строгосрочные вклады"
  ]
}
